{
  "purpose": "FastAPI service for syncing CRM leads into a reporting dashboard.",
  "language": "python",
  "frameworks": ["fastapi", "sqlalchemy"],
  "existing_heartbeat": "none",
  "goals": [
    "keep integrations healthy",
    "surface ingestion failures quickly",
    "improve deployment safety"
  ],
  "recommended_modules": [
    {
      "id": "heartbeat-core",
      "reason": "Needed to drive autonomous checks."
    },
    {
      "id": "immune-router",
      "reason": "Tracks failures across the ingest path."
    }
  ],
  "risk_flags": [
    "background jobs are not monitored",
    "deployment rollback path is manual"
  ]
}
